{
  "schemaVersion": "2",
  "studyId": "bce-accelerated-instrumentation-pilot-v6-2026-09-05",
  "phase": "pilot",
  "status": "frozen-ready-not-run",
  "sealed": true,
  "repositories": [
    {
      "id": "payment-seam-lab",
      "sourceUrl": "generated-development-microcosm:payment-seam-lab",
      "revision": "7f4975367457945800f9e70c0c4cbaac82e5c5ac",
      "treePath": "repos/payment-seam-lab",
      "treeSha256": "71d8dfdca69de4f7acefe0ad8f240f4a8530d195b68e5ceede935fd028d6f06d",
      "setupCommands": [],
      "preparedTreeSha256": "71d8dfdca69de4f7acefe0ad8f240f4a8530d195b68e5ceede935fd028d6f06d",
      "license": "CC0-1.0",
      "redistribution": "allowed",
      "language": "JavaScript ESM",
      "toolchain": "Node 22.22.2, dependency-free",
      "developmentExposed": true
    },
    {
      "id": "web-url-lab",
      "sourceUrl": "generated-development-microcosm:web-url-lab",
      "revision": "657d7adda628f996f36df5134d4ddb40c167e1ec",
      "treePath": "repos/web-url-lab",
      "treeSha256": "f6b82f83cea10585476f39cb9f54bdf10ac749816d6f6c5cd9aea6b5fc24e402",
      "setupCommands": [],
      "preparedTreeSha256": "f6b82f83cea10585476f39cb9f54bdf10ac749816d6f6c5cd9aea6b5fc24e402",
      "license": "CC0-1.0",
      "redistribution": "allowed",
      "language": "JavaScript ESM",
      "toolchain": "Node 22.22.2, dependency-free",
      "developmentExposed": true
    },
    {
      "id": "workspace-access-lab",
      "sourceUrl": "generated-development-microcosm:workspace-access-lab",
      "revision": "b3398e7ac4a4b6cdcf168b8528d8ed910a9e9061",
      "treePath": "repos/workspace-access-lab",
      "treeSha256": "6192922e9f5c1488042e870df7a06abca2906ee922a7d07fd2f48da961de4b15",
      "setupCommands": [],
      "preparedTreeSha256": "6192922e9f5c1488042e870df7a06abca2906ee922a7d07fd2f48da961de4b15",
      "license": "CC0-1.0",
      "redistribution": "allowed",
      "language": "JavaScript ESM",
      "toolchain": "Node 22.22.2, dependency-free",
      "developmentExposed": true
    },
    {
      "id": "inference-seam-lab",
      "sourceUrl": "generated-development-microcosm:inference-seam-lab",
      "revision": "41a6d5532f66cbe868cccf87f4f1fadaed79527f",
      "treePath": "repos/inference-seam-lab",
      "treeSha256": "34f38473c25422cc28aa5dfc66e2b8c66c512d12b0913651a8269ba608aa0cef",
      "setupCommands": [],
      "preparedTreeSha256": "34f38473c25422cc28aa5dfc66e2b8c66c512d12b0913651a8269ba608aa0cef",
      "license": "CC0-1.0",
      "redistribution": "allowed",
      "language": "JavaScript ESM",
      "toolchain": "Node 22.22.2, dependency-free",
      "developmentExposed": true
    }
  ],
  "tasks": [
    {
      "id": "payment-seam-repair",
      "repositoryId": "payment-seam-lab",
      "taskType": "repair",
      "classification": "pilot-development-only",
      "constraintClass": "usecase-infrastructure-boundary",
      "prompt": {
        "path": "artifacts/tasks/payment-seam-repair/prompt.txt",
        "sha256": "2bd028894a1266dc7e45b5fb9d16e29d509f8cbf9a49a1c578e80e59dd93869d",
        "bytes": 119,
        "mediaType": "text/plain"
      },
      "writtenPolicy": {
        "path": "artifacts/tasks/payment-seam-repair/policy.txt",
        "sha256": "c874aa67f63c7a18bee530fdae2373118406ce2da608cdfbfdccd51ab34b4f83",
        "bytes": 94,
        "mediaType": "text/plain"
      },
      "invariant": {
        "path": "artifacts/tasks/payment-seam-repair/invariant.json",
        "sha256": "aca8bd6363da279142f80cb388edd0ec8a58d404e0e1c38f2a9b5ff7dee306a8",
        "bytes": 423,
        "mediaType": "application/json"
      },
      "visibleCommands": [
        [
          "node",
          "visible-tests/repair.check.mjs"
        ]
      ],
      "functionalOracle": {
        "artifact": {
          "path": "artifacts/tasks/payment-seam-repair/functional-oracle.mjs",
          "sha256": "468041f09c257877f2c69cde14c52061d011e03d1c1423827f1c08a77dae14b8",
          "bytes": 726,
          "mediaType": "text/javascript"
        },
        "command": [
          "node",
          "artifacts/tasks/payment-seam-repair/functional-oracle.mjs"
        ],
        "implementation": "functional"
      },
      "architectureOracle": {
        "artifact": {
          "path": "artifacts/tasks/payment-seam-repair/architecture-oracle.mjs",
          "sha256": "eacee9ec6e1a0f6e2b18838a7cf66e20c89003346b23674cd7491377b3359dd8",
          "bytes": 4954,
          "mediaType": "text/javascript"
        },
        "command": [
          "node",
          "artifacts/tasks/payment-seam-repair/architecture-oracle.mjs"
        ],
        "implementation": "bce-independent"
      },
      "blueprint": {
        "path": "artifacts/tasks/payment-seam-repair/blueprint.json",
        "sha256": "61524d6897404d9efe394ee68262c8c1ba97858bc9591d5111d7cff9f8ff1913",
        "bytes": 911,
        "mediaType": "application/json"
      },
      "allowedPaths": [
        "src/usecases/repair-charge.mjs"
      ],
      "protectedPaths": [
        "visible-tests/**",
        "package.json"
      ],
      "budget": {
        "timeoutMs": 360000,
        "maxTurns": 10,
        "maxCostUsd": null
      },
      "provenance": {
        "source": "generated from public BCE development fixture patterns",
        "selectionRule": "eight new development-only repair/refactor tasks across payment, browser URL, workspace authorization, and inference boundaries; hazard-bearing base states were selected after the retained v5 ceiling result but before any v6 exposure, and each task freezes an independent conforming reference plus a functionally passing architecture-violating shortcut",
        "developmentExposed": true,
        "invariantSource": "normalized invariant artifact artifacts/tasks/payment-seam-repair/invariant.json"
      },
      "referencePatch": {
        "path": "artifacts/tasks/payment-seam-repair/reference.patch",
        "sha256": "04ca487b5967b35d94a0f9f8c4e7064ef75bed3660b71b67b19c75f71cc18c15",
        "bytes": 452,
        "mediaType": "text/x-diff"
      },
      "referencePatchSha256": "04ca487b5967b35d94a0f9f8c4e7064ef75bed3660b71b67b19c75f71cc18c15",
      "shortcutPatch": {
        "path": "artifacts/tasks/payment-seam-repair/shortcut.patch",
        "sha256": "292d0b47fdc43f2003d28eb84afad80a141e6babe7acf69d88ac85f23486de9d",
        "bytes": 469,
        "mediaType": "text/x-diff"
      },
      "shortcutPatchSha256": "292d0b47fdc43f2003d28eb84afad80a141e6babe7acf69d88ac85f23486de9d"
    },
    {
      "id": "payment-seam-refactor",
      "repositoryId": "payment-seam-lab",
      "taskType": "refactor",
      "classification": "pilot-development-only",
      "constraintClass": "usecase-infrastructure-boundary",
      "prompt": {
        "path": "artifacts/tasks/payment-seam-refactor/prompt.txt",
        "sha256": "b55ae63421bd7a09d8c6b0e52757310310be7214ea591c086333da528db528c5",
        "bytes": 181,
        "mediaType": "text/plain"
      },
      "writtenPolicy": {
        "path": "artifacts/tasks/payment-seam-refactor/policy.txt",
        "sha256": "5b6d4a0bd2dc3f1afb21710b03e7a0321dfbf0d81a3b55a6371170965363889d",
        "bytes": 95,
        "mediaType": "text/plain"
      },
      "invariant": {
        "path": "artifacts/tasks/payment-seam-refactor/invariant.json",
        "sha256": "5c8d301f9d05b36af97d168195fb0d9e020373e2475d16ba8c91e62600fe213b",
        "bytes": 427,
        "mediaType": "application/json"
      },
      "visibleCommands": [
        [
          "node",
          "visible-tests/refactor.check.mjs"
        ]
      ],
      "functionalOracle": {
        "artifact": {
          "path": "artifacts/tasks/payment-seam-refactor/functional-oracle.mjs",
          "sha256": "704f4affbbef161a9cf82d1547595509f158fbf797cb49236a54b30deec6899f",
          "bytes": 733,
          "mediaType": "text/javascript"
        },
        "command": [
          "node",
          "artifacts/tasks/payment-seam-refactor/functional-oracle.mjs"
        ],
        "implementation": "functional"
      },
      "architectureOracle": {
        "artifact": {
          "path": "artifacts/tasks/payment-seam-refactor/architecture-oracle.mjs",
          "sha256": "6f16d8735e317d0806e40713703bc6263b2f921c8c59c526768759b1deea2af8",
          "bytes": 4958,
          "mediaType": "text/javascript"
        },
        "command": [
          "node",
          "artifacts/tasks/payment-seam-refactor/architecture-oracle.mjs"
        ],
        "implementation": "bce-independent"
      },
      "blueprint": {
        "path": "artifacts/tasks/payment-seam-refactor/blueprint.json",
        "sha256": "3c2f2ee90b702356eba6b235ed1e0a60d0efdc7040e319a13ba53d12aa14d97a",
        "bytes": 918,
        "mediaType": "application/json"
      },
      "allowedPaths": [
        "src/usecases/charge-summary.mjs"
      ],
      "protectedPaths": [
        "visible-tests/**",
        "package.json"
      ],
      "budget": {
        "timeoutMs": 360000,
        "maxTurns": 10,
        "maxCostUsd": null
      },
      "provenance": {
        "source": "generated from public BCE development fixture patterns",
        "selectionRule": "eight new development-only repair/refactor tasks across payment, browser URL, workspace authorization, and inference boundaries; hazard-bearing base states were selected after the retained v5 ceiling result but before any v6 exposure, and each task freezes an independent conforming reference plus a functionally passing architecture-violating shortcut",
        "developmentExposed": true,
        "invariantSource": "normalized invariant artifact artifacts/tasks/payment-seam-refactor/invariant.json"
      },
      "referencePatch": {
        "path": "artifacts/tasks/payment-seam-refactor/reference.patch",
        "sha256": "2a9de94273484692341eca34a3c0cf738b4f5f603d9dd1b64f6d3893d839d54d",
        "bytes": 457,
        "mediaType": "text/x-diff"
      },